id	name	description	rating	country	city	restaurantDetails
38	Hotel Abora Catarina	Znakomicie położony, blisko centrum kurortu z restauracjami i pubami, w spokojnym miejscu na początku Tirajana Avenue, niedaleko rezerwatu przyrody Dunas des Maspalomas. Profesjonalnie prowadzony, ma 3 zadbane baseny, przepiękny ogród i nowocześnie urządzone, jasne wnętrza. Szczególnie polecany dla rodzin z dziećmi, dla których przygotowano wiele atrakcji.	5.0	Wyspy Kanaryjskie	Gran Canaria
39	Hotel Azure Memories	Nowo wybudowany, elegancki i stylowy, składa się z budynku głównego i willi w niskiej zabudowie z białego kamienia. To wymarzone miejsce na romantyczne wakacje w wyjątkowej, kameralnej atmosferze. Gustowne pokoje, świetny serwis i atrakcje siostrzanego hotelu Azure Resort & Spa, pozwolą w pełni cieszyć się z wakacji na greckiej wyspie. Blisko stąd do pięknej plaży i centrum Tsilivi – znanego kurortu na wschodzie wyspy oraz miasta Zakynthos, do którego można dojechać lokalnym autobusem.	5.2	Grecja	Zakynthos
40	Hotel Santa Lucia e Le Sabbie D'oro	Bardzo popularny wśród naszych Gości, którzy doceniają świetne położenie i dobry serwis hotelowy. Do ślicznego Cefalu dojść można mniej więcej w 20 min, spacerowym krokiem, przyjemną nadmorską promenadą lub dojechać komunikacją publiczną spod hotelu. Zabytkowe miasteczko uwiedzie każdego kolorowymi uliczkami i niezliczonymi miejscami do zabawy i jedzenia. Romantyczny widok na La Rocca, majestatyczną skałę, dominującą nad Cefalu, podziwiać można także z hotelowej plaży i zadbanego basenu.	4.4	Włochy	Sycylia
41	Hotel Royal Horizon Boa Vista	Jeśli szukasz idealnego miejsca na egzotyczny urlop, to mamy dla Ciebie coś wyjątkowego! Hotel położony na rozległym terenie, na pięknej, rajskiej wyspie Boa Vista, której nazwa oznacza „dobry widok”, z resztą nie bez powodu – tutaj oczy cieszy niemal wszystko, w tym turkusowy, krystalicznie czysty ocean, błękitne niebo, białe plaże i piękna panorama okolicy! Obiekt jest bardzo chwalony i lubiany przez Gości, zachwyca wysoką jakością usług, przemiłym personelem, doskonałą kuchnią oraz licznymi udogodnieniami – na miejscu do dyspozycji jest kilka basenów, 4 bary i ciekawe atrakcje dla wczasowiczów w każdym wieku, spośród których szczególnie doceniane są animacje, prowadzone przez zespół profesjonalnych animatorów. O krok stąd znajduje się szeroka, przestronna plaża z drobnym piaskiem i wydzieloną częścią hotelową, którą Goście najchętniej wybierają na relaks – tu każdy znajdzie dla siebie miejsce na spokojny wypoczynek na leżaku.	5.4	Wyspy Zielonego Przylądka	Boa Vista
42	Hotel R2 Pajara Beach	Lubiany za wakacyjną atmosferę, zaprojektowany z rozmachem, położony w pięknym miejscu blisko najsłynniejszych plaż Fuerteventury. Oferuje znakomite warunki na wakacje dla wszystkich kochających słońce i ocean. Ciekawa architektura hotelu, imponujący hol z panoramicznymi windami i wodospadem, komfortowe pokoje z marmurowymi łazienkami i podłogami to znakomite połączenie estetyki i funkcjonalności. Firmowany przez grupę R2 gwarantuje profesjonalny serwis i unikalny program ExpeR2ience.	5.1	Wyspy Kanaryjskie	Fuerteventura
43	Hotel Royal Karthago Djerba	Uroczy hotel, którego wielkość widoczna jest dopiero w trakcie wieczornych pokazów i przedstawień. Idealny na rodzinne, aktywne wakacje! Pokoje mieszczą się w niewysokich bungalowach ukrytych między bujną roślinnością, tworzącą zaciszne zakątki. Spokój strefy mieszkalnej równoważy bogaty program zajęć sportowych i animacyjnych w rejonie basenu, plaży, amfiteatru i barów.	5.1	Tunezja	Djerba
44	Hotel Blue Sea Holiday Village (ex. Lippia Resort & Spa)	Wymarzona propozycja na aktywne, rodzinne wakacje. Hotel zaprasza miłośników wspólnej zabawy, dorosłych i dzieciaki, dla których największą frajdą jest świetnie zorganizowany pobyt i bycie w ruchu od rana do wieczora. Profesjonalni animatorzy troszczą się o dobre humory Gości, są tutaj także świetne warunki do zadbania o kondycję fizyczną: korty tenisowe, minigolf, siatkówka. Hotel leży niedaleko plaży, gdzie na Gości czeka turkusowe, idealnie czyste morze i szeroka oferta sportów wodnych. Hotel znany jest z dobrego poziomu formuły all inclusive – potrawy z bogatych bufetów są nie tylko smaczne, ale także pięknie zaprezentowane.	5.2	Grecja	Rodos
45	Hotel Barceló Punta Umbria Beach Resort	Fantastycznie położony, otoczony zielenią lasów, bielą plaży i błękitem oceanu. Firmowany przez bardzo popularną i lubianą wśród polskich turystów sieć Barceló, oferującą dobrej klasy hotele all inclusive na całym świecie. Przyjazna i profesjonalna obsługa pozwoli Ci się w pełni zrelaksować. Jeżeli marzysz o rodzinnych wakacjach, lubisz dobrą kuchnię i cenisz uroki niezatłoczonych plaż, jest to miejsce w sam raz dla Ciebie. 	5.1	Hiszpania	Costa de la Luz
46	Hotel Grand Blue Fafa	Elegancki i nowoczesny, jest doskonałą propozycją na wakacje w gronie rodziny i przyjaciół. Położony bezpośrednio przy piaszczystej plaży z bezpłatnym serwisem, oferuje przestronne i komfortowe pokoje z widokiem na morze. Głównym punktem hotelu jest duży, fantazyjny basen z tarasem słonecznym, a na najmłodszych wczasowiczów czeka brodzik i wodny plac zabaw. W obiekcie są 3 restauracje i 2 bary, a na terenie całego hotelu można korzystać z bezpłatnego internetu bezprzewodowego. Oto idealne miejsce na pełen relaks w spokojnym, słonecznym Golem.	5.1	Albania	Durres
47	Jumbo Resort	Cudowny, zanurzony w tropikalnym ogrodzie o pow. 2 tys. m², malowniczo położony w zatoce Jacaranda, pomiędzy parkami morskimi, tuż przy pięknej, obsypanej białym piaskiem plaży. Składa się z kilku klimatycznych budynków w arabskim stylu, rozmieszczonych wśród bugenwilli i palm, w których mieszczą się komfortowe pokoje, część z widokiem na ocean. Centralne miejsce w hotelu zajmują 2 fantazyjne baseny ze słoną wodą i zachwycającymi widokami. Nowa część willowa oferuje komfortowe wille z indywidualnymi wejściami i dużym basenem w pięknym ogrodzie. Cały kompleks to doskonałe miejsce dla rodzin z dziećmi, na które czekają tu ciekawe zajęcia, a nawet minidisco. W hotelu szeroka oferta sportowa i animacje. Odpocznij, wyluzuj się i w pełni korzystaj z wypoczynku – hakuna matata!	4.5	Kenia	Kenia
48	Hotel Mirador Maspalomas by Dunas	Całkowicie odnowiony, ze świetną wakacyjną atmosferą, jest znakomitym wyborem na wakacje z rodziną. Mnóstwo atrakcji dla dzieci: wspaniałe baseny, plac i pokój zabaw, miniklub, animacje. Funkcjonalnie urządzone pokoje dostępne w wersji standardowej lub rodzinnej. Hotel zapewnia bezpłatny dowóz do pięknej plaży Maspalomas ze słynnymi wydmami – wizytówką Gran Canarii.	4.8	Wyspy Kanaryjskie	Gran Canaria
49	Hotel White Dreams Resort	Położony na wzgórzu Profitis Amos, niedaleko od centrum Faliraki, przeznaczony jest tylko dla dorosłych Gości. To doskonała propozycja na romantyczne wakacje we dwoje! Hotel oferuje wygodne i nowoczesne pokoje, 2 duże baseny i restaurację serwującą znakomite potrawy lokalnej kuchni. W okolicy znajdują się dwie plaże: spokojna i cicha Kathara oraz jedyna na Rodos plaża dla nudystów. To również świetna baza wypadowa do zwiedzania najpiękniejszych zakątków północno-wschodniej części wyspy. Hotel leży tuż obok siostrzanego hotelu Kriamos Blue.	5.5	Grecja	Rodos
